Name,Average Temperature (°C),Radius (km),Color,Interesting Feature
Mercury,167,2439.7,Gray,Mercury has the most extreme temperature variation in the solar system.
Venus,464,6051.8,Yellowish-white,"Venus has a surface temperature that is hotter than Mercury’s, despite being farther from the Sun."
Earth,14,6371.0,Blue and green,Earth is the only known planet to support life.
Mars,-60,3389.5,Red,"Mars is home to the tallest volcano in the solar system, Olympus Mons."
Jupiter,-108,69911.0,Orange with white bands,"Jupiter is the largest planet in the solar system and has a giant storm, the Great Red Spot."
Saturn,-139,58232.0,Yellow with brownish hues,"Saturn is famous for its spectacular ring system, made mostly of ice and rock."
Uranus,-197,25362.0,Pale blue,"Uranus rotates on its side, with its axis tilted over 90 degrees."
Neptune,-200,24622.0,Deep blue,"Neptune has the strongest winds in the solar system, reaching speeds of up to 2,100 km/h."
